{"schemaVersion":3,"producer":{"pluginVersion":"0.5.0","rulesetVersion":"1.0.0-beta.5","buildSha":"local","channel":"development"},"rulesetVersion":"1.0.0-beta.5","catalogVersion":"1.17.0","catalogDigest":"sha256:d4b412615775cc1fc500c6dcfd3e36d51dc3be7ec6a741edfc7f0969fb7e4ded","profileHash":"h53:0ab118e58fcdb1","target":{"scope":"selection","rootIds":["root:desktop"],"knowledgeSnapshotHash":"h53:17c9c688029ac3","knowledgeComplete":true},"axes":[{"axis":"token-foundation","score":100,"passedWeight":8,"applicableWeight":8,"multiplier":1,"statusCounts":{"pass":4,"fail":0,"needs-review":0,"waived":0,"not-applicable":0}},{"axis":"token-application","score":100,"passedWeight":13,"applicableWeight":13,"multiplier":2,"statusCounts":{"pass":6,"fail":0,"needs-review":0,"waived":0,"not-applicable":0}},{"axis":"layer-naming","score":100,"passedWeight":8,"applicableWeight":8,"multiplier":2,"statusCounts":{"pass":3,"fail":0,"needs-review":0,"waived":0,"not-applicable":0}},{"axis":"structure-auto-layout","score":100,"passedWeight":5,"applicableWeight":5,"multiplier":1,"statusCounts":{"pass":2,"fail":0,"needs-review":0,"waived":0,"not-applicable":0}},{"axis":"component-hygiene","score":100,"passedWeight":0,"applicableWeight":0,"multiplier":1,"statusCounts":{"pass":1,"fail":0,"needs-review":0,"waived":0,"not-applicable":1}},{"axis":"responsive-completeness","score":84.6,"passedWeight":11,"applicableWeight":13,"multiplier":1,"statusCounts":{"pass":4,"fail":1,"needs-review":0,"waived":0,"not-applicable":0}},{"axis":"accessibility","score":100,"passedWeight":4,"applicableWeight":4,"multiplier":1,"statusCounts":{"pass":2,"fail":0,"needs-review":2,"waived":0,"not-applicable":0}},{"axis":"pipeline-readiness","score":100,"passedWeight":15,"applicableWeight":15,"multiplier":2,"statusCounts":{"pass":6,"fail":0,"needs-review":0,"waived":0,"not-applicable":0}}],"frames":[{"rootId":"root:desktop","rootName":"Hero / Desktop / 1440","rootType":"FRAME","pageId":"page:1","pageName":"Screens","grade":{"score":98.6,"letter":"A"},"ready":true,"blockerIds":[],"axisScores":[{"axis":"token-foundation","score":100,"passedWeight":8,"applicableWeight":8,"multiplier":1,"statusCounts":{"pass":4,"fail":0,"needs-review":0,"waived":0,"not-applicable":0}},{"axis":"token-application","score":100,"passedWeight":13,"applicableWeight":13,"multiplier":2,"statusCounts":{"pass":6,"fail":0,"needs-review":0,"waived":0,"not-applicable":0}},{"axis":"layer-naming","score":100,"passedWeight":8,"applicableWeight":8,"multiplier":2,"statusCounts":{"pass":3,"fail":0,"needs-review":0,"waived":0,"not-applicable":0}},{"axis":"structure-auto-layout","score":100,"passedWeight":5,"applicableWeight":5,"multiplier":1,"statusCounts":{"pass":2,"fail":0,"needs-review":0,"waived":0,"not-applicable":0}},{"axis":"component-hygiene","score":100,"passedWeight":0,"applicableWeight":0,"multiplier":1,"statusCounts":{"pass":1,"fail":0,"needs-review":0,"waived":0,"not-applicable":1}},{"axis":"responsive-completeness","score":84.6,"passedWeight":11,"applicableWeight":13,"multiplier":1,"statusCounts":{"pass":4,"fail":1,"needs-review":0,"waived":0,"not-applicable":0}},{"axis":"accessibility","score":100,"passedWeight":4,"applicableWeight":4,"multiplier":1,"statusCounts":{"pass":2,"fail":0,"needs-review":2,"waived":0,"not-applicable":0}},{"axis":"pipeline-readiness","score":100,"passedWeight":15,"applicableWeight":15,"multiplier":2,"statusCounts":{"pass":6,"fail":0,"needs-review":0,"waived":0,"not-applicable":0}}],"variantCoverage":[],"tokenCoverage":{"counts":{"bound":11,"inherited":0,"ignored":3,"missing":0},"applicable":11,"coverage":100,"groups":[{"disposition":"bound","field":"fills","reason":"variable","count":3,"samples":[{"nodeId":"root:desktop","nodePath":"Screens / Hero / Desktop / 1440"},{"nodeId":"text:1","nodePath":"Screens / Hero / Desktop / 1440 / Heading"},{"nodeId":"button:1","nodePath":"Screens / Hero / Desktop / 1440 / Button / Primary"}],"truncated":false},{"disposition":"bound","field":"fontSize","reason":"variable","count":1,"samples":[{"nodeId":"text:1","nodePath":"Screens / Hero / Desktop / 1440 / Heading"}],"truncated":false},{"disposition":"bound","field":"fontWeight","reason":"variable","count":1,"samples":[{"nodeId":"text:1","nodePath":"Screens / Hero / Desktop / 1440 / Heading"}],"truncated":false},{"disposition":"bound","field":"itemSpacing","reason":"variable","count":1,"samples":[{"nodeId":"root:desktop","nodePath":"Screens / Hero / Desktop / 1440"}],"truncated":false},{"disposition":"bound","field":"lineHeight","reason":"variable","count":1,"samples":[{"nodeId":"text:1","nodePath":"Screens / Hero / Desktop / 1440 / Heading"}],"truncated":false},{"disposition":"bound","field":"paddingBottom","reason":"variable","count":1,"samples":[{"nodeId":"root:desktop","nodePath":"Screens / Hero / Desktop / 1440"}],"truncated":false},{"disposition":"bound","field":"paddingLeft","reason":"variable","count":1,"samples":[{"nodeId":"root:desktop","nodePath":"Screens / Hero / Desktop / 1440"}],"truncated":false},{"disposition":"bound","field":"paddingRight","reason":"variable","count":1,"samples":[{"nodeId":"root:desktop","nodePath":"Screens / Hero / Desktop / 1440"}],"truncated":false},{"disposition":"bound","field":"paddingTop","reason":"variable","count":1,"samples":[{"nodeId":"root:desktop","nodePath":"Screens / Hero / Desktop / 1440"}],"truncated":false},{"disposition":"ignored","field":"opacity","reason":"inert-default","count":3,"samples":[{"nodeId":"root:desktop","nodePath":"Screens / Hero / Desktop / 1440"},{"nodeId":"text:1","nodePath":"Screens / Hero / Desktop / 1440 / Heading"},{"nodeId":"button:1","nodePath":"Screens / Hero / Desktop / 1440 / Button / Primary"}],"truncated":false}]}}],"grade":{"score":98.6,"letter":"A"},"ready":true,"blockers":[],"findings":[{"ruleId":"accessibility.behavior-review","axis":"accessibility","severity":1,"rootId":"root:desktop","nodeId":"root:desktop","nodePath":"Screens / Hero / Desktop / 1440","status":"needs-review","title":"Keyboard, focus, and semantic behavior","message":"Figma geometry cannot prove keyboard operation, focus order, focus visibility, or ARIA semantics; manual review is required.","evidence":{"summary":"Figma geometry cannot prove keyboard operation, focus order, focus visibility, or ARIA semantics; manual review is required.","measured":{"interactiveCount":1,"inactiveInteractiveCount":0}},"fixability":"manual","sourceRefs":[{"kind":"wcag","label":"WCAG 2.2 — 2.5.8 Target Size (Minimum)","url":"https://www.w3.org/TR/WCAG22/#target-size-minimum"}],"scoreImpact":false,"id":"accessibility.behavior-review:root:desktop:root:desktop","confidence":1,"category":"requirement","provenance":{"kind":"direct","contextKey":"h53:03cac7281d8042","sourceNodeId":"root:desktop","sourceLabel":"Screens / Hero / Desktop / 1440"}},{"ruleId":"accessibility.target-minimum","axis":"accessibility","severity":2,"rootId":"root:desktop","nodeId":"button:1","nodePath":"Screens / Hero / Desktop / 1440 / Button / Primary","status":"needs-review","title":"Minimum target size","message":"0 evidenced targets fail the 24×24 minimum and spacing condition; 0 satisfy the spacing exception; 1 need target or exception review. Prototype targets provide geometry evidence; equivalent controls, inline links, user-agent controls, and essential sizing exceptions need manual confirmation where applicable.","evidence":{"summary":"0 evidenced targets fail the 24×24 minimum and spacing condition; 0 satisfy the spacing exception; 1 need target or exception review. Prototype targets provide geometry evidence; equivalent controls, inline links, user-agent controls, and essential sizing exceptions need manual confirmation where applicable.","measured":{"interactiveCount":1,"inactiveInteractiveCount":0,"undersizedCount":0,"reviewCount":1,"sizedWithoutPointerEvidenceCount":0,"spacingExceptionCount":0,"targetEvidence":[{"nodeId":"button:1","explicitPointerInteraction":false,"assessment":"review","bounds":null}]}},"fixability":"manual","sourceRefs":[{"kind":"wcag","label":"WCAG 2.2 — 2.5.8 Target Size (Minimum)","url":"https://www.w3.org/TR/WCAG22/#target-size-minimum"}],"scoreImpact":false,"id":"accessibility.target-minimum:root:desktop:button:1","confidence":1,"category":"requirement","provenance":{"kind":"direct","contextKey":"h53:1822bceeb776f0","sourceNodeId":"button:1","sourceLabel":"Screens / Hero / Desktop / 1440 / Button / Primary"}},{"ruleId":"accessibility.target-preferred","axis":"accessibility","severity":1,"rootId":"root:desktop","nodeId":"root:desktop","nodePath":"Screens / Hero / Desktop / 1440","status":"pass","title":"Preferred touch target","message":"0 target candidates are below the enhanced 44×44 size. This recommendation does not lower the grade.","evidence":{"summary":"0 target candidates are below the enhanced 44×44 size. This recommendation does not lower the grade.","measured":{"interactiveCount":1,"inactiveInteractiveCount":0,"belowPreferredCount":0}},"fixability":"manual","sourceRefs":[{"kind":"wcag","label":"WCAG 2.2 — 2.5.5 Target Size (Enhanced, AAA)","url":"https://www.w3.org/TR/WCAG22/#target-size-enhanced"}],"scoreImpact":false,"id":"accessibility.target-preferred:root:desktop:root:desktop","confidence":1,"category":"recommendation","hardBlocker":false,"provenance":{"kind":"direct","contextKey":"h53:063ad19e4a5768","sourceNodeId":"root:desktop","sourceLabel":"Screens / Hero / Desktop / 1440"}},{"ruleId":"accessibility.text-contrast","axis":"accessibility","severity":4,"rootId":"root:desktop","nodeId":"root:desktop","nodePath":"Screens / Hero / Desktop / 1440","status":"pass","title":"WCAG 2.2 AA text contrast","message":"1 active text layers were measured; 0 failed, 0 require manual review, and 0 explicitly disabled-control layers were exempt.","evidence":{"summary":"1 active text layers were measured; 0 failed, 0 require manual review, and 0 explicitly disabled-control layers were exempt.","measured":{"textNodeCount":1,"activeTextNodeCount":1